<!ELEMENT library (book | journal | misc)*>

<!ELEMENT book (title, editor?, publisher?)>
<!ATTLIST book id CDATA #REQUIRED>

<!ELEMENT journal (title, volume?, number?)>
<!ATTLIST journal
	id CDATA #REQUIRED
	publ_year CDATA #IMPLIED>

<!ELEMENT misc (author*, title, year?, pages?)>
<!ATTLIST misc id CDATA #REQUIRED>

<!ELEMENT title (#PCDATA)>
<!ELEMENT editor (#PCDATA)>
<!ELEMENT publisher (#PCDATA)>
<!ELEMENT author (#PCDATA)>
<!ELEMENT volume (#PCDATA)>
<!ELEMENT number (#PCDATA)>
<!ELEMENT year (#PCDATA)>
<!ELEMENT pages (#PCDATA)>
