<?xml version="1.0" encoding="UTF-8"?>
<!DOCTYPE library SYSTEM "library.dtd">
<library>
  <book id="2003-Blanken">
    <title>Intelligent XML Search</title>
    <editor>Henk A. Blanken et al.</editor>
    <publisher>Springer Verlag</publisher>
  </book>
  <journal id="TODS_1_2003" publ_year="2003">
    <title>ACM Transactions on Databases</title>
    <volume>24</volume>
    <number>1</number>
  </journal>
  <misc id="Dipl2002-12">
    <author>U. Known</author>
    <title>The Diploma Thesis that did not appear</title>
    <year>2002</year>
    <pages>0</pages>
  </misc>
</library>
